{
  "schema_version": 1,
  "baseline_version": "0.1.0",
  "published_on": "2026-07-29",
  "compatibility": {
    "postgresql": "14-18",
    "validated_postgresql": "18.4",
    "pigsty": "4.4.0",
    "target_os": "Ubuntu 24.04 L1",
    "local_validation": "PostgreSQL 18.4/Homebrew on macOS",
    "scope": "pg36_shop teaching application and Pigsty L1 workflow"
  },
  "source_chapters": [
    "ch01",
    "ch02",
    "ch03",
    "ch04",
    "ch05"
  ],
  "future_evidence_chapters": [
    "ch07",
    "ch08",
    "ch09",
    "ch10",
    "ch11"
  ],
  "levels": {
    "safety": {
      "meaning": "违反后可能造成数据错误、越权、不可恢复变更或不可归因事故；默认阻断 merge/deploy。",
      "exception": "仅允许 none 或有 owner、expiry、补偿控制和事后复核的 breakglass。"
    },
    "default": {
      "meaning": "团队统一采用的工程默认；不同场景可以有证据地偏离。",
      "exception": "使用 waiver，记录 owner、原因、expiry、检查方式与回归默认的条件。"
    },
    "preference": {
      "meaning": "在多个正确方案之间改善可读性、维护性或成本的偏好。",
      "exception": "由 reviewer 根据场景证据决定，不作为无条件阻断项。"
    }
  },
  "rules": [
    {
      "id": "SAFE-CONN-001",
      "title": "精确声明并验证连接目标",
      "level": "safety",
      "status": "active",
      "owner": "database-engineering",
      "scope": [
        "scripts",
        "migrations",
        "operations"
      ],
      "statement": "所有自动化在执行 SQL 前必须验证 database、effective role、read/write 状态与预期 search_path；目标由 service/受控配置声明，不依赖交互终端当前连接。",
      "rationale": "连得上只证明网络和认证成功，不能证明目标 database、role 或 primary 正确；错误目标上的正确 SQL 仍是事故。",
      "evidence": [
        {
          "chapter": "ch02",
          "artifact": "/labs/ch02/context.sql",
          "observation": "context guard 对 database、recovery、role 与 search_path 逐项拒绝。"
        },
        {
          "chapter": "ch05",
          "artifact": "/labs/ch05/context.sql",
          "observation": "并发实验在写入前再次验证 ch04-v1 与 writable target。"
        }
      ],
      "exception": {
        "mode": "none",
        "requirements": [
          "若工具无法执行 preflight，则不得获得写权限；需先发布新的受控入口。"
        ]
      },
      "checks": [
        {
          "kind": "automated",
          "criterion": "quality gate 的 wrong-target probe 必须以非零状态拒绝。"
        },
        {
          "kind": "runtime",
          "criterion": "证据包保存 current_database、session_user/current_user 与 pg_is_in_recovery。"
        }
      ]
    },
    {
      "id": "SAFE-SECR-002",
      "title": "凭据不进入仓库、命令行或证据包",
      "level": "safety",
      "status": "active",
      "owner": "platform-security",
      "scope": [
        "connections",
        "ci",
        "evidence"
      ],
      "statement": "密码和等价 secret 只能来自权限受控的 passfile、secret provider 或交互提示；禁止嵌入 URI、shell history、source file、manifest 与 stdout/stderr。",
      "rationale": "命令行、仓库和 CI artifact 的复制面远大于数据库本身，泄露后难以确认所有副本并完成撤销。",
      "evidence": [
        {
          "chapter": "ch02",
          "artifact": "/labs/ch02/pg_service.conf.example",
          "observation": "service file 示例只声明连接身份，明确把 password 留给 mode 0600 passfile。"
        },
        {
          "chapter": "ch02",
          "artifact": "/labs/ch02/task.sh",
          "observation": "自动化使用 -w，拒绝隐式密码提示与泄露式 fallback。"
        }
      ],
      "exception": {
        "mode": "none",
        "requirements": [
          "需要非交互认证时接入受控 secret provider，不以临时明文替代。"
        ]
      },
      "checks": [
        {
          "kind": "automated",
          "criterion": "扫描受管 source/evidence schema 中的 password assignment、带凭据 URI 与 PGPASSWORD。"
        },
        {
          "kind": "review",
          "criterion": "确认 manifest 只保存 service name，不保存展开后的连接 secret。"
        }
      ]
    },
    {
      "id": "SAFE-ROLE-003",
      "title": "分离登录角色、对象所有者与运行角色",
      "level": "safety",
      "status": "active",
      "owner": "database-engineering",
      "scope": [
        "roles",
        "schemas",
        "applications"
      ],
      "statement": "对象由 NOLOGIN owner 持有；application/read-only 使用独立 LOGIN role 且不是 superuser、createdb、createrole 或 bypassrls；日常应用不能以 owner 身份登录。",
      "rationale": "所有权授予隐式 DDL/授权能力；把 owner 当 runtime identity 会让 SQL injection 和应用缺陷越过显式 GRANT 边界。",
      "evidence": [
        {
          "chapter": "ch01",
          "artifact": "/labs/ch01/setup.sql",
          "observation": "pg36_owner、pg36_app、pg36_ro 的登录与特权责任被分离。"
        },
        {
          "chapter": "ch04",
          "artifact": "/labs/ch04/verify-v1.sql",
          "observation": "catalog 验证对象 owner、app/ro table 与 sequence 权限。"
        }
      ],
      "exception": {
        "mode": "breakglass",
        "requirements": [
          "仅限受审计 migration session",
          "精确时间窗",
          "非共享身份",
          "完成后撤销",
          "保存 catalog 后验"
        ]
      },
      "checks": [
        {
          "kind": "runtime",
          "criterion": "pg_roles 与 has_*_privilege 证明 runtime role 无 owner/superuser 权限。"
        }
      ]
    },
    {
      "id": "SAFE-DEFR-004",
      "title": "SECURITY DEFINER 固定解析上下文并收回 PUBLIC 执行权",
      "level": "safety",
      "status": "active",
      "owner": "database-security",
      "scope": [
        "functions",
        "triggers",
        "privilege-boundaries"
      ],
      "statement": "SECURITY DEFINER function 必须由受控 owner 持有，固定以 pg_catalog 开头且只含可信 schema 的 search_path，schema-qualify 敏感对象，并显式撤销 PUBLIC EXECUTE 后按需授权。",
      "rationale": "definer function 在高权限身份下解析名称；可写 schema 或 PUBLIC execute 会把 search_path/object replacement 变成提权路径。",
      "evidence": [
        {
          "chapter": "ch04",
          "artifact": "/labs/ch04/migrate-v0-to-v1.sql",
          "observation": "状态转换 trigger function 固定 pg_catalog, shop_private 并收回 PUBLIC EXECUTE。"
        },
        {
          "chapter": "ch04",
          "artifact": "/labs/ch04/verify-v1.sql",
          "observation": "prosecdef、proconfig、owner 与 direct execute privilege 均由 catalog 验证。"
        }
      ],
      "exception": {
        "mode": "none",
        "requirements": [
          "无法满足时改用 invoker function 或重新设计权限边界。"
        ]
      },
      "checks": [
        {
          "kind": "automated",
          "criterion": "对 pg_proc.prosecdef 对象验证 owner、proconfig 与 PUBLIC/app direct EXECUTE。"
        }
      ]
    },
    {
      "id": "SAFE-CONS-005",
      "title": "关键不变量由命名约束与反例闭合",
      "level": "safety",
      "status": "active",
      "owner": "data-model-owner",
      "scope": [
        "ddl",
        "business-invariants",
        "error-contracts"
      ],
      "statement": "能由单库 schema 表达的关键值域、唯一性、引用与行内一致性必须使用命名约束；每个关键约束至少有一个验证 constraint identity/SQLSTATE 的反例。",
      "rationale": "只在 application 校验会留下旁路；只写正向 seed 则不能证明数据库确实拒绝错误或拒绝的是预期规则。",
      "evidence": [
        {
          "chapter": "ch04",
          "artifact": "/labs/ch04/negative-cases.sql",
          "observation": "反例同时核对 SQLSTATE 和 CONSTRAINT_NAME。"
        },
        {
          "chapter": "ch04",
          "artifact": "/labs/ch04/constraint-lab.sql",
          "observation": "EXCLUDE 与 DEFERRABLE 行为在 rollback-only transaction 中验证。"
        }
      ],
      "exception": {
        "mode": "breakglass",
        "requirements": [
          "证明不变量跨外部系统或无法由当前数据库表达",
          "记录 application control",
          "保留 reconciliation",
          "设置到期复查"
        ]
      },
      "checks": [
        {
          "kind": "runtime",
          "criterion": "negative suite 只捕获预期 SQLSTATE/constraint，任何意外成功都失败。"
        },
        {
          "kind": "review",
          "criterion": "明确哪些跨表或外部事实仍未由本次 DDL 保证。"
        }
      ]
    },
    {
      "id": "SAFE-MIGR-006",
      "title": "破坏性迁移先证明可表示并设置停止线",
      "level": "safety",
      "status": "active",
      "owner": "database-change-owner",
      "scope": [
        "migrations",
        "ddl",
        "data-conversion"
      ],
      "statement": "类型收窄、列删除、表重写或约束收紧前必须在写入前完成可表示性 precheck，声明 lock/statement timeout、兼容窗口、失败恢复和 post-state；生产 contract 与 application rollback 共同设计。",
      "rationale": "直接 cast/drop 会在迁移中途才暴露坏值或依赖，并可能因强锁无限等待；机械 down migration 也无法恢复已丢弃语义。",
      "evidence": [
        {
          "chapter": "ch04",
          "artifact": "/labs/ch04/migrate-v0-to-v1.sql",
          "observation": "numeric 特殊值、精度、范围与状态时间在 DROP/ALTER 前被拒绝，DDL 在事务和 timeout 内执行。"
        },
        {
          "chapter": "ch04",
          "artifact": "/labs/ch04/physical-decisions.md",
          "observation": "L1 单事务演练与生产 expand/backfill/switch/contract 边界明确分开。"
        }
      ],
      "exception": {
        "mode": "breakglass",
        "requirements": [
          "incident commander 批准",
          "可恢复备份/PITR 证据",
          "精确停止线",
          "业务影响声明",
          "事后补齐兼容迁移"
        ]
      },
      "checks": [
        {
          "kind": "review",
          "criterion": "变更说明完整回答 expand、backfill、validate、switch、contract 与 forward repair。"
        },
        {
          "kind": "runtime",
          "criterion": "污染 fixture 时迁移非零退出且旧 schema/version marker 保持一致。"
        }
      ]
    },
    {
      "id": "SAFE-TXNN-007",
      "title": "首个事务错误触发显式恢复",
      "level": "safety",
      "status": "active",
      "owner": "application-team",
      "scope": [
        "transactions",
        "connection-pools",
        "error-handling"
      ],
      "statement": "显式事务的首个 error 必须被保存；代码只能整体 ROLLBACK，或回到事先建立且语义允许的 savepoint。failed/idle-in-transaction 连接不得归还连接池。",
      "rationale": "错误后 transaction 进入 failed state，后续普通 SQL 只产生 25P02；若连接泄漏到 pool，还会持锁、持 snapshot 或污染下一请求。",
      "evidence": [
        {
          "chapter": "ch05",
          "artifact": "/labs/ch05/transaction-errors.sql",
          "observation": "22012 后下一 statement 收到 25P02；ROLLBACK TO SAVEPOINT 才允许局部恢复。"
        },
        {
          "chapter": "ch05",
          "artifact": "/labs/ch05/lab-contract.md",
          "observation": "worker 正常和失败路径都要求关闭 transaction/session 并后验无残留。"
        }
      ],
      "exception": {
        "mode": "none",
        "requirements": [
          "未知错误不得用 savepoint 吞掉；应结束整个 transaction。"
        ]
      },
      "checks": [
        {
          "kind": "automated",
          "criterion": "transaction test 必须观察原始 SQLSTATE、25P02 和最终 state_restored。"
        },